branch,document_id,criterion_id,item_uid,clause_id,path,entity_type,entity_text,operator,value_type,value,unit,computability,evidence_text,layer1a_issues,layer1b_flags,layer1c_warnings,layer1d_issues,all_layer1_codes,layer1_policy_bucket,layer1_policy_severity,layer1_policy_action_hint,layer1_policy_reasons,layer1_policy_score,layer1_policy_hard_issue_count,layer1_policy_soft_warning_count,layer1_policy_execution_issue_count
B,NCT01856491,NCT01856491_inc__item4_C1,NCT01856491_inc__item4,C1,inclusion_criteria.children[3].children[0],other,willing to participate in all testing/ visits associated with this clinical study,exists,null,,,non_computable,Willing and capable of participating in all testing/ visits associated with this clinical study,,,,,,no_layer1_issue,none,continue_to_layer2,,0.0,0,0,0
B,NCT01856491,NCT01856491_inc__item4_C2,NCT01856491_inc__item4,C2,inclusion_criteria.children[3].children[1],other,capable of participating in all testing/ visits associated with this clinical study,exists,null,,,non_computable,Willing and capable of participating in all testing/ visits associated with this clinical study,,,,,,no_layer1_issue,none,continue_to_layer2,,0.0,0,0,0
B,NCT01856491,NCT01856491_inc__item4_C3,NCT01856491_inc__item4,C3,inclusion_criteria.children[3].children[2],other,participation occurs at an approved clinical study center,exists,null,,,non_computable,at an approved clinical study center,,,,,,no_layer1_issue,none,continue_to_layer2,,0.0,0,0,0
B,NCT01856491,NCT01856491_inc__item4_C4,NCT01856491_inc__item4,C4,inclusion_criteria.children[3].children[3],other,participation occurs at the intervals defined by this protocol,exists,null,,,non_computable,at the intervals defined by this protocol,,,,,,no_layer1_issue,none,continue_to_layer2,,0.0,0,0,0
B,NCT01856491,NCT01856491_inc__item5_C1,NCT01856491_inc__item5,C1,inclusion_criteria.children[4].children[0],demographic,Age,>=,scalar,18,year,computable,Age 18 or above,,,,,,no_layer1_issue,none,continue_to_layer2,,0.0,0,0,0
B,NCT01856491,NCT01856491_inc__item5_C2,NCT01856491_inc__item5,C2,inclusion_criteria.children[4].children[1],other,Legal age to give informed consent per state and national law,exists,null,,,non_computable,of legal age to give informed consent specific to state and national law,,,,,,no_layer1_issue,none,continue_to_layer2,,0.0,0,0,0
B,NCT01856491,NCT01856491_exc__item1_C1,NCT01856491_exc__item1,C1,exclusion_criteria.children[0].children[0],drug,sensitivity to Dexamethasone Acetate (DXA),exists,null,,,partial,Known or suspected sensitivity to Dexamethasone Acetate (DXA),,,,,,no_layer1_issue,none,continue_to_layer2,,0.0,0,0,0
B,NCT01856491,NCT01856491_exc__item1_C2,NCT01856491_exc__item1,C2,exclusion_criteria.children[0].children[1],drug,suspected sensitivity to Dexamethasone Acetate (DXA),exists,null,,,partial,Known or suspected sensitivity to Dexamethasone Acetate (DXA),,,,,,no_layer1_issue,none,continue_to_layer2,,0.0,0,0,0
B,NCT01856491,NCT01856491_exc__item2_C1,NCT01856491_exc__item2,C1,exclusion_criteria.children[1],procedure,mechanical tricuspid heart valve,exists,null,,,computable,Mechanical tricuspid heart valve,,,,,,no_layer1_issue,none,continue_to_layer2,,0.0,0,0,0
B,NCT01856491,NCT01856491_exc__item3_C1,NCT01856491_exc__item3,C1,exclusion_criteria.children[2].children[0],observation,enrolled in any other concurrent study without prior written approval from Boston Scientific (BSC),exists,null,,,non_computable,Subject is enrolled in any other concurrent study without prior written approval from Boston Scientific (BSC),,,,,,no_layer1_issue,none,continue_to_layer2,,0.0,0,0,0
B,NCT01856491,NCT01856491_exc__item3_C2,NCT01856491_exc__item3,C2,exclusion_criteria.children[2].children[1],observation,enrolled in local mandatory governmental registries,exists,null,,,partial,with the exception of local mandatory governmental registries,,,,,,no_layer1_issue,none,continue_to_layer2,,0.0,0,0,0
B,NCT01856491,NCT01856491_exc__item3_C3,NCT01856491_exc__item3,C3,exclusion_criteria.children[2].children[2].children[0],observation,enrolled in observational studies/registries that are not in conflict,exists,null,,,non_computable,observational studies/registries that are not in conflict,,,,,,no_layer1_issue,none,continue_to_layer2,,0.0,0,0,0
B,NCT01856491,NCT01856491_exc__item3_C4,NCT01856491_exc__item3,C4,exclusion_criteria.children[2].children[2].children[1],observation,enrolled in observational studies/registries that do not affect the following,exists,null,,,non_computable,observational studies/registries that are not in conflict and do not affect the following:,,,,,,no_layer1_issue,none,continue_to_layer2,,0.0,0,0,0
B,NCT01856491,NCT01856491_exc__item4_C1,NCT01856491_exc__item4,C1,exclusion_criteria.children[3].children[0],other,Schedule of procedures should not cause additional visits,exists,null,,,non_computable,Schedule of procedures for the RELIANCE 4-Front Study (i.e. should not cause additional or missed visits),,,,,,no_layer1_issue,none,continue_to_layer2,,0.0,0,0,0
B,NCT01856491,NCT01856491_exc__item4_C2,NCT01856491_exc__item4,C2,exclusion_criteria.children[3].children[1],other,Schedule of procedures should not cause missed visits,exists,null,,,non_computable,Schedule of procedures for the RELIANCE 4-Front Study (i.e. should not cause additional or missed visits),,,,,,no_layer1_issue,none,continue_to_layer2,,0.0,0,0,0
B,NCT01856491,NCT01856491_exc__item5_C1,NCT01856491_exc__item5,C1,exclusion_criteria.children[4].children[0],other,RELIANCE 4-Front Study outcome,exists,null,,,non_computable,RELIANCE 4-Front Study outcome,,,,,,no_layer1_issue,none,continue_to_layer2,,0.0,0,0,0
B,NCT01856491,NCT01856491_exc__item5_C2,NCT01856491_exc__item5,C2,exclusion_criteria.children[4].children[1],drug,medications that could affect the heart rate of the subject,exists,null,,,partial,involve medications that could affect the heart rate of the subject,,,,,,no_layer1_issue,none,continue_to_layer2,,0.0,0,0,0
B,NCT01856491,NCT01856491_exc__item6_C1,NCT01856491_exc__item6,C1,exclusion_criteria.children[5].children[0],other,conduct of the RELIANCE 4-Front Study per Good Clinical Practice (GCP),exists,null,,,non_computable,Conduct of the RELIANCE 4-Front Study per Good Clinical Practice (GCP)/ International Organization for Standardization (ISO) 14155:2011/ 21 CFR 812/ local regulations,,,,,,no_layer1_issue,none,continue_to_layer2,,0.0,0,0,0
B,NCT01856491,NCT01856491_exc__item6_C2,NCT01856491_exc__item6,C2,exclusion_criteria.children[5].children[1],other,conduct of the RELIANCE 4-Front Study per International Organization for Standardization (ISO) 14155:2011,exists,null,,,non_computable,Conduct of the RELIANCE 4-Front Study per Good Clinical Practice (GCP)/ International Organization for Standardization (ISO) 14155:2011/ 21 CFR 812/ local regulations,,,,,,no_layer1_issue,none,continue_to_layer2,,0.0,0,0,0
B,NCT01856491,NCT01856491_exc__item6_C3,NCT01856491_exc__item6,C3,exclusion_criteria.children[5].children[2],other,conduct of the RELIANCE 4-Front Study per 21 CFR 812,exists,null,,,non_computable,Conduct of the RELIANCE 4-Front Study per Good Clinical Practice (GCP)/ International Organization for Standardization (ISO) 14155:2011/ 21 CFR 812/ local regulations,,,,,,no_layer1_issue,none,continue_to_layer2,,0.0,0,0,0
B,NCT01856491,NCT01856491_exc__item6_C4,NCT01856491_exc__item6,C4,exclusion_criteria.children[5].children[3],other,conduct of the RELIANCE 4-Front Study per local regulations,exists,null,,,non_computable,Conduct of the RELIANCE 4-Front Study per Good Clinical Practice (GCP)/ International Organization for Standardization (ISO) 14155:2011/ 21 CFR 812/ local regulations,,,,,,no_layer1_issue,none,continue_to_layer2,,0.0,0,0,0
B,NCT01856491,NCT01856491_exc__item7_C1,NCT01856491_exc__item7,C1,exclusion_criteria.children[6],observation,active heart transplant list status,exists,null,,,partial,Currently on the active heart transplant list,,,,,,no_layer1_issue,none,continue_to_layer2,,0.0,0,0,0
B,NCT01856491,NCT01856491_exc__item8_C1,NCT01856491_exc__item8,C1,exclusion_criteria.children[7],observation,life expectancy,<,scalar,12,month,computable,Documented life expectancy of less than 12 months,,,,,,no_layer1_issue,none,continue_to_layer2,,0.0,0,0,0
B,NCT01856491,NCT01856491_exc__item9_C1,NCT01856491_exc__item9,C1,exclusion_criteria.children[8].children[0].children[0],demographic,women of childbearing potential,exists,null,,,partial,Women of childbearing potential,,,,,,no_layer1_issue,none,continue_to_layer2,,0.0,0,0,0
B,NCT01856491,NCT01856491_exc__item9_C2,NCT01856491_exc__item9,C2,exclusion_criteria.children[8].children[0].children[1],condition,pregnant,exists,null,,,computable,are or might be pregnant at the time of study enrollment,,,,,,no_layer1_issue,none,continue_to_layer2,,0.0,0,0,0
B,NCT01856491,NCT01856491_exc__item9_C3,NCT01856491_exc__item9,C3,exclusion_criteria.children[8].children[1],condition,might be pregnant,exists,null,,,non_computable,are or might be pregnant at the time of study enrollment,,,,,,no_layer1_issue,none,continue_to_layer2,,0.0,0,0,0
B,NCT01856491,NCT01856491_exc__item10_C1,NCT01856491_exc__item10,C1,exclusion_criteria.children[9],procedure,chronic dialysis requirement,exists,null,,,partial,Currently requiring chronic dialysis,,,requirement_object_inversion,,layer1c:requirement_object_inversion,hard_semantic_or_structural_issue,high,mandatory_verifier_candidate,hard_semantic:requirement_object_inversion,1.0,1,0,0
B,NCT01959061,NCT01959061_inc__item1_C1,NCT01959061_inc__item1,C1,inclusion_criteria.children[0],condition,colorectal adenocarcinoma,exists,null,,,computable,Histologically confirmed colorectal adenocarcinoma,,,,,,no_layer1_issue,none,continue_to_layer2,,0.0,0,0,0
B,NCT01959061,NCT01959061_inc__item2_C1,NCT01959061_inc__item2,C1,inclusion_criteria.children[1].children[0].children[0],condition,disease limited to the liver,exists,null,,,partial,Disease limited to the liver,,,,,,no_layer1_issue,none,continue_to_layer2,,0.0,0,0,0
B,NCT01959061,NCT01959061_inc__item2_C2,NCT01959061_inc__item2,C2,inclusion_criteria.children[1].children[0].children[1],observation,unresectable disease by surgery,exists,null,,,partial,Unresectable disease by surgery or other local therapies,,,,,,no_layer1_issue,none,continue_to_layer2,,0.0,0,0,0
B,NCT01959061,NCT01959061_inc__item2_C3,NCT01959061_inc__item2,C3,inclusion_criteria.children[1].children[1],observation,unresectable disease by other local therapies,exists,null,,,partial,Unresectable disease by surgery or other local therapies,,,,,,no_layer1_issue,none,continue_to_layer2,,0.0,0,0,0
B,NCT01959061,NCT01959061_inc__item3_C1,NCT01959061_inc__item3,C1,inclusion_criteria.children[2],demographic,Age,>,scalar,18,year,computable,Age >18 years,,,,,,no_layer1_issue,none,continue_to_layer2,,0.0,0,0,0
B,NCT01959061,NCT01959061_inc__item4_C1,NCT01959061_inc__item4,C1,inclusion_criteria.children[3].children[0].children[0],observation,ECOG performance status,between,range,"{""min"": 0, ""max"": 2}",,computable,ECOG performance status 0-2,,,,,,no_layer1_issue,none,continue_to_layer2,,0.0,0,0,0
B,NCT01959061,NCT01959061_inc__item4_C2,NCT01959061_inc__item4,C2,inclusion_criteria.children[3].children[0].children[1],observation,Child-Pugh class,=,scalar,"""A""",,computable,Child pugh A or B,,,,,,no_layer1_issue,none,continue_to_layer2,,0.0,0,0,0
B,NCT01959061,NCT01959061_inc__item4_C3,NCT01959061_inc__item4,C3,inclusion_criteria.children[3].children[1],observation,Child-Pugh class,=,scalar,"""B""",,computable,Child pugh A or B,,,,,,no_layer1_issue,none,continue_to_layer2,,0.0,0,0,0
B,NCT01959061,NCT01959061_inc__item5_C1,NCT01959061_inc__item5,C1,inclusion_criteria.children[4],observation,expected survival,=,scalar,3,month,partial,Expected survival = 3 months,,,,,,no_layer1_issue,none,continue_to_layer2,,0.0,0,0,0
B,NCT01959061,NCT01959061_inc__item6_C1,NCT01959061_inc__item6,C1,inclusion_criteria.children[5].children[0],observation,adequate hematological function,exists,null,,,partial,"Adequate hematological, hepatic, and renal function",,,,,,no_layer1_issue,none,continue_to_layer2,,0.0,0,0,0
B,NCT01959061,NCT01959061_inc__item6_C2,NCT01959061_inc__item6,C2,inclusion_criteria.children[5].children[1],observation,adequate hepatic function,exists,null,,,partial,"Adequate hematological, hepatic, and renal function",,,,,,no_layer1_issue,none,continue_to_layer2,,0.0,0,0,0
B,NCT01959061,NCT01959061_inc__item6_C3,NCT01959061_inc__item6,C3,inclusion_criteria.children[5].children[2],observation,adequate renal function,exists,null,,,partial,"Adequate hematological, hepatic, and renal function",,,,,,no_layer1_issue,none,continue_to_layer2,,0.0,0,0,0
B,NCT01959061,NCT01959061_exc__item1_C1,NCT01959061_exc__item1,C1,exclusion_criteria.children[0].children[0],condition,Pregnant,exists,null,,,computable,Pregnant,,,,,,no_layer1_issue,none,continue_to_layer2,,0.0,0,0,0
B,NCT01959061,NCT01959061_exc__item1_C2,NCT01959061_exc__item1,C2,exclusion_criteria.children[0].children[1],condition,lactating women,exists,null,,,computable,lactating women,,,,,,no_layer1_issue,none,continue_to_layer2,,0.0,0,0,0
B,NCT01959061,NCT01959061_exc__item2_C1,NCT01959061_exc__item2,C1,exclusion_criteria.children[1].children[0],condition,severe organ dysfunction,exists,null,,,partial,severe organ dysfunction or failure,,,,,,no_layer1_issue,none,continue_to_layer2,,0.0,0,0,0
B,NCT01959061,NCT01959061_exc__item2_C2,NCT01959061_exc__item2,C2,exclusion_criteria.children[1].children[1],condition,severe organ failure,exists,null,,,partial,severe organ dysfunction or failure,,,,,,no_layer1_issue,none,continue_to_layer2,,0.0,0,0,0
B,NCT01959061,NCT01959061_exc__item3_C1,NCT01959061_exc__item3,C1,exclusion_criteria.children[2].children[0],condition,severe cardiovascular disease,exists,null,,,partial,severe cardiovascular disease,,,,,,no_layer1_issue,none,continue_to_layer2,,0.0,0,0,0
B,NCT01959061,NCT01959061_exc__item3_C2,NCT01959061_exc__item3,C2,exclusion_criteria.children[2].children[1],condition,mental,exists,null,,,partial,mental,,,,,,no_layer1_issue,none,continue_to_layer2,,0.0,0,0,0
B,NCT01959061,NCT01959061_exc__item4_C1,NCT01959061_exc__item4,C1,exclusion_criteria.children[3],condition,extraliver metastases,exists,null,,,computable,Extraliver metastases,,,,,,no_layer1_issue,none,continue_to_layer2,,0.0,0,0,0
B,NCT03226080,NCT03226080_inc__item1_C1,NCT03226080_inc__item1,C1,inclusion_criteria.children[0],observation,ASA physical status classification,between,range,"{""min"": ""I"", ""max"": ""IV""}",,partial,ASA I-IV,,,,,,no_layer1_issue,none,continue_to_layer2,,0.0,0,0,0
B,NCT03226080,NCT03226080_inc__item1_C2,NCT03226080_inc__item1,C2,inclusion_criteria.children[1],demographic,Age,>=,scalar,55,year,computable,Age 55 or older,,,,,,no_layer1_issue,none,continue_to_layer2,,0.0,0,0,0
B,NCT03226080,NCT03226080_inc__item1_C3,NCT03226080_inc__item1,C3,inclusion_criteria.children[2],procedure,Operative repair of isolated intertrochanteric hip fracture (scheduled),exists,null,,,partial,Scheduled for operative repair of isolated intertrochanteric hip fracture,,,,,,no_layer1_issue,none,continue_to_layer2,,0.0,0,0,0
B,NCT03226080,NCT03226080_exc__item1_C1,NCT03226080_exc__item1,C1,exclusion_criteria.children[0],other,inability to consent,exists,null,,,non_computable,Inability to consent/refusal,,,critical_qualifier_missing_from_entity,,layer1c:critical_qualifier_missing_from_entity,soft_semantic_warning,low_to_medium,continue_to_layer2_grounding_screen,soft_semantic:critical_qualifier_missing_from_entity,0.4,0,1,0
B,NCT03226080,NCT03226080_exc__item1_C2,NCT03226080_exc__item1,C2,exclusion_criteria.children[1],other,refusal,exists,null,,,non_computable,Inability to consent/refusal,,,,,,no_layer1_issue,none,continue_to_layer2,,0.0,0,0,0
B,NCT03226080,NCT03226080_exc__item1_C3,NCT03226080_exc__item1,C3,exclusion_criteria.children[2],drug,allergy to any of the study medications,exists,null,,,partial,Allergy to any of the study medications,,,,,,no_layer1_issue,none,continue_to_layer2,,0.0,0,0,0
B,NCT03226080,NCT03226080_exc__item1_C4,NCT03226080_exc__item1,C4,exclusion_criteria.children[3],condition,multiple traumatic injuries,exists,null,,,computable,Multiple traumatic injuries,,,,,,no_layer1_issue,none,continue_to_layer2,,0.0,0,0,0
B,NCT03226080,NCT03226080_exc__item1_C5,NCT03226080_exc__item1,C5,exclusion_criteria.children[4],procedure,contraindication to neuraxial anesthesia,exists,null,,,partial,Contraindication to neuraxial or general anesthesia,,,,,,no_layer1_issue,none,continue_to_layer2,,0.0,0,0,0
B,NCT03226080,NCT03226080_exc__item1_C6,NCT03226080_exc__item1,C6,exclusion_criteria.children[5],procedure,contraindication to general anesthesia,exists,null,,,partial,Contraindication to neuraxial or general anesthesia,,,,,,no_layer1_issue,none,continue_to_layer2,,0.0,0,0,0
B,NCT03226080,NCT03226080_exc__item1_C7,NCT03226080_exc__item1,C7,exclusion_criteria.children[6],condition,pregnancy,exists,null,,,computable,Pregnancy,,,,,,no_layer1_issue,none,continue_to_layer2,,0.0,0,0,0
B,NCT01932996,NCT01932996_inc__item1_C1,NCT01932996_inc__item1,C1,inclusion_criteria.children[0],observation,homeless,exists,null,,,partial,Currently Homeless,,,,,,no_layer1_issue,none,continue_to_layer2,,0.0,0,0,0
B,NCT01932996,NCT01932996_inc__item2_C1,NCT01932996_inc__item2,C1,inclusion_criteria.children[1],observation,cigarettes smoked in lifetime,>=,scalar,100,cigarette,partial,Smoked at least 100 cigarettes in lifetime,,,,,,no_layer1_issue,none,continue_to_layer2,,0.0,0,0,0
B,NCT01932996,NCT01932996_inc__item3_C1,NCT01932996_inc__item3,C1,inclusion_criteria.children[2].children[0],observation,AUDIT score,>=,scalar,5,,computable,"AUDIT score of > or equal to 5, < or equal to 26",,,,,,no_layer1_issue,none,continue_to_layer2,,0.0,0,0,0
B,NCT01932996,NCT01932996_inc__item3_C2,NCT01932996_inc__item3,C2,inclusion_criteria.children[2].children[1],observation,AUDIT score,<=,scalar,26,,computable,"AUDIT score of > or equal to 5, < or equal to 26",,,,,,no_layer1_issue,none,continue_to_layer2,,0.0,0,0,0
B,NCT01932996,NCT01932996_inc__item4_C1,NCT01932996_inc__item4,C1,inclusion_criteria.children[3],demographic,Age,>=,scalar,18,year,computable,Aged 18 years or older,,,,,,no_layer1_issue,none,continue_to_layer2,,0.0,0,0,0
B,NCT01932996,NCT01932996_inc__item5_C1,NCT01932996_inc__item5,C1,inclusion_criteria.children[4].children[0],other,willing to attend study sessions,exists,null,,,non_computable,Willing to attend study sessions,,,,,,no_layer1_issue,none,continue_to_layer2,,0.0,0,0,0
B,NCT01932996,NCT01932996_inc__item5_C2,NCT01932996_inc__item5,C2,inclusion_criteria.children[4].children[1],other,willing to follow other study protocol,exists,null,,,non_computable,follow other study protocol,,,,,,no_layer1_issue,none,continue_to_layer2,,0.0,0,0,0
B,NCT01932996,NCT01932996_exc__item1_C1,NCT01932996_exc__item1,C1,exclusion_criteria.children[0].children[0],drug,smoking cessation medications,exists,null,,,partial,Use of smoking cessation medications or interventions in last 30 days,,,,,,no_layer1_issue,none,continue_to_layer2,,0.0,0,0,0
B,NCT01932996,NCT01932996_exc__item1_C2,NCT01932996_exc__item1,C2,exclusion_criteria.children[0].children[1],therapy,smoking cessation interventions,exists,null,,,partial,Use of smoking cessation medications or interventions in last 30 days,,,,,,no_layer1_issue,none,continue_to_layer2,,0.0,0,0,0
B,NCT01932996,NCT01932996_exc__item2_C1,NCT01932996_exc__item2,C1,exclusion_criteria.children[1].children[0],condition,unstable medical illness,exists,null,,,partial,Unstable medical illness,,,,,,no_layer1_issue,none,continue_to_layer2,,0.0,0,0,0
B,NCT01932996,NCT01932996_exc__item2_C2,NCT01932996_exc__item2,C2,exclusion_criteria.children[1].children[1],observation,requires immediate medical care,exists,null,,,partial,that requires immediate medical care,,,,,,no_layer1_issue,none,continue_to_layer2,,0.0,0,0,0
B,NCT01932996,NCT01932996_exc__item3_C1,NCT01932996_exc__item3,C1,exclusion_criteria.children[2].children[0],observation,AUDIT score,<,scalar,5,,computable,AUDIT score of < 5 or > 26,,,,,,no_layer1_issue,none,continue_to_layer2,,0.0,0,0,0
B,NCT01932996,NCT01932996_exc__item3_C2,NCT01932996_exc__item3,C2,exclusion_criteria.children[2].children[1],observation,AUDIT score,>,scalar,26,,computable,AUDIT score of < 5 or > 26,,,,,,no_layer1_issue,none,continue_to_layer2,,0.0,0,0,0
B,NCT01932996,NCT01932996_exc__item4_C1,NCT01932996_exc__item4,C1,exclusion_criteria.children[3].children[0],condition,pregnancy,exists,null,,,computable,Pregnancy,,,,,,no_layer1_issue,none,continue_to_layer2,,0.0,0,0,0
B,NCT01932996,NCT01932996_exc__item4_C2,NCT01932996_exc__item4,C2,exclusion_criteria.children[3].children[1],observation,Nicotine Replacement Therapy (NRT) contraindications,exists,null,,,partial,other Nicotine Replacement Therapy (NRT) contraindications,,,,,,no_layer1_issue,none,continue_to_layer2,,0.0,0,0,0
B,NCT01932996,NCT01932996_exc__item5_C1,NCT01932996_exc__item5,C1,exclusion_criteria.children[4].children[0],condition,psychotic disorder,exists,null,,,partial,Current history or in past 6 months of psychotic disorder or major depressive disorders,,,,,,no_layer1_issue,none,continue_to_layer2,,0.0,0,0,0
B,NCT01932996,NCT01932996_exc__item5_C2,NCT01932996_exc__item5,C2,exclusion_criteria.children[4].children[1],condition,psychotic disorder,exists,null,,,partial,Current history or in past 6 months of psychotic disorder,,,,,,no_layer1_issue,none,continue_to_layer2,,0.0,0,0,0
B,NCT01932996,NCT01932996_exc__item5_C3,NCT01932996_exc__item5,C3,exclusion_criteria.children[4].children[2],condition,major depressive disorders,exists,null,,,partial,Current history or in past 6 months of psychotic disorder or major depressive disorders,,,,,,no_layer1_issue,none,continue_to_layer2,,0.0,0,0,0
B,NCT01932996,NCT01932996_exc__item5_C4,NCT01932996_exc__item5,C4,exclusion_criteria.children[4].children[3].children[0],condition,major depressive disorders,exists,null,,,partial,Current history or in past 6 months of psychotic disorder or major depressive disorders,,,,,,no_layer1_issue,none,continue_to_layer2,,0.0,0,0,0
B,NCT01932996,NCT01932996_exc__item5_C5,NCT01932996_exc__item5,C5,exclusion_criteria.children[4].children[3].children[1],observation,not stable on treatment,exists,null,,,partial,psychotic disorder or major depressive disorders that is not stable on treatment for past 3 months,,,,,,no_layer1_issue,none,continue_to_layer2,,0.0,0,0,0
B,NCT01932996,NCT01932996_exc__item6_C1,NCT01932996_exc__item6,C1,exclusion_criteria.children[5],condition,cognitive impairment,exists,null,,,computable,Cognitive impairment,,,,,,no_layer1_issue,none,continue_to_layer2,,0.0,0,0,0
B,NCT02637076,NCT02637076_inc__item1_C1,NCT02637076_inc__item1,C1,inclusion_criteria.children[0],condition,narcolepsy with cataplexy,exists,null,,,computable,current diagnosis of narcolepsy with cataplexy,,,,,,no_layer1_issue,none,continue_to_layer2,,0.0,0,0,0
B,NCT02637076,NCT02637076_inc__item1_C2,NCT02637076_inc__item1,C2,inclusion_criteria.children[1],observation,healthy control,exists,null,,,partial,healthy control,,,,,,no_layer1_issue,none,continue_to_layer2,,0.0,0,0,0
B,NCT02637076,NCT02637076_exc__item1_C1,NCT02637076_exc__item1,C1,exclusion_criteria.children[0].children[0],drug,sedative hypnotics,exists,null,,,partial,"use of any sedative hypnotics, tranquilizers, anticonvulsants, antihistamines (except non-sedating), benzodiazepines, clonidine or any medication known to affect dopamine at start of baseline period",,,condition_context_present_without_handling,,layer1c:condition_context_present_without_handling,hard_semantic_or_structural_issue,high,mandatory_verifier_candidate,hard_semantic:condition_context_present_without_handling,1.0,1,0,0
B,NCT02637076,NCT02637076_exc__item1_C2,NCT02637076_exc__item1,C2,exclusion_criteria.children[0].children[1],drug,tranquilizers,exists,null,,,partial,"use of any sedative hypnotics, tranquilizers, anticonvulsants, antihistamines (except non-sedating), benzodiazepines, clonidine or any medication known to affect dopamine at start of baseline period",,,condition_context_present_without_handling,,layer1c:condition_context_present_without_handling,hard_semantic_or_structural_issue,high,mandatory_verifier_candidate,hard_semantic:condition_context_present_without_handling,1.0,1,0,0
B,NCT02637076,NCT02637076_exc__item1_C3,NCT02637076_exc__item1,C3,exclusion_criteria.children[0].children[2],drug,anticonvulsants,exists,null,,,partial,"use of any sedative hypnotics, tranquilizers, anticonvulsants, antihistamines (except non-sedating), benzodiazepines, clonidine or any medication known to affect dopamine at start of baseline period",,,condition_context_present_without_handling,,layer1c:condition_context_present_without_handling,hard_semantic_or_structural_issue,high,mandatory_verifier_candidate,hard_semantic:condition_context_present_without_handling,1.0,1,0,0
B,NCT02637076,NCT02637076_exc__item1_C4,NCT02637076_exc__item1,C4,exclusion_criteria.children[0].children[3],drug,antihistamines (except non-sedating),exists,null,,,partial,"use of any sedative hypnotics, tranquilizers, anticonvulsants, antihistamines (except non-sedating), benzodiazepines, clonidine or any medication known to affect dopamine at start of baseline period",,,condition_context_present_without_handling,,layer1c:condition_context_present_without_handling,hard_semantic_or_structural_issue,high,mandatory_verifier_candidate,hard_semantic:condition_context_present_without_handling,1.0,1,0,0
