branch,document_id,criterion_id,item_uid,clause_id,path,entity_type,entity_text,operator,value_type,value,unit,computability,evidence_text,layer1a_issues,layer1b_flags,layer1c_warnings,layer1d_issues,all_layer1_codes,layer1_policy_bucket,layer1_policy_severity,layer1_policy_action_hint,layer1_policy_reasons,layer1_policy_score,layer1_policy_hard_issue_count,layer1_policy_soft_warning_count,layer1_policy_execution_issue_count
B,NCT00319748,NCT00319748_exc__item10_C2,NCT00319748_exc__item10,C2,exclusion_criteria.children[9].children[1],condition,cardiac arrhythmias,exists,null,,,computable,"Cardiac ischemia, cardiac arrhythmias or congestive heart failure uncontrolled by medication",,,critical_qualifier_missing_from_entity,,layer1c:critical_qualifier_missing_from_entity,soft_semantic_warning,low_to_medium,continue_to_layer2_grounding_screen,soft_semantic:critical_qualifier_missing_from_entity,0.4,0,1,0
B,NCT00319748,NCT00319748_exc__item10_C3,NCT00319748_exc__item10,C3,exclusion_criteria.children[9].children[2],condition,congestive heart failure uncontrolled by medication,exists,null,,,partial,"Cardiac ischemia, cardiac arrhythmias or congestive heart failure uncontrolled by medication",,,,,,no_layer1_issue,none,continue_to_layer2,,0.0,0,0,0
B,NCT00319748,NCT00319748_exc__item11_C1,NCT00319748_exc__item11,C1,exclusion_criteria.children[10].children[0],condition,"condition which, in the opinion of the investigator, could confound the results of the study",exists,null,,,partial,"History of, or clinical evidence of, a condition which, in the opinion of the investigator, could confound the results of the study",,,,,,no_layer1_issue,none,continue_to_layer2,,0.0,0,0,0
B,NCT00319748,NCT00319748_exc__item11_C2,NCT00319748_exc__item11,C2,exclusion_criteria.children[10].children[1],condition,"condition which, in the opinion of the investigator, could confound the results of the study",exists,null,,,partial,"History of, or clinical evidence of, a condition which, in the opinion of the investigator, could confound the results of the study",,,,,,no_layer1_issue,none,continue_to_layer2,,0.0,0,0,0
B,NCT00319748,NCT00319748_exc__item11_C3,NCT00319748_exc__item11,C3,exclusion_criteria.children[10].children[2],condition,"condition which, in the opinion of the investigator, could put the subject at undue risk",exists,null,,,partial,"History of, or clinical evidence of, a condition which, in the opinion of the investigator, could confound the results of the study or put the subject at undue risk",,,,,,no_layer1_issue,none,continue_to_layer2,,0.0,0,0,0
B,NCT00319748,NCT00319748_exc__item11_C4,NCT00319748_exc__item11,C4,exclusion_criteria.children[10].children[3],condition,"condition which, in the opinion of the investigator, could put the subject at undue risk",exists,null,,,partial,"History of, or clinical evidence of, a condition which, in the opinion of the investigator, could confound the results of the study or put the subject at undue risk",,,,,,no_layer1_issue,none,continue_to_layer2,,0.0,0,0,0
B,NCT00319748,NCT00319748_exc__item12_C1,NCT00319748_exc__item12,C1,exclusion_criteria.children[11].children[0],condition,uncontrolled intercurrent illness,exists,null,,,partial,Uncontrolled intercurrent or chronic illness,,,,,,no_layer1_issue,none,continue_to_layer2,,0.0,0,0,0
B,NCT00319748,NCT00319748_exc__item12_C2,NCT00319748_exc__item12,C2,exclusion_criteria.children[11].children[1],condition,uncontrolled chronic illness,exists,null,,,partial,Uncontrolled intercurrent or chronic illness,,,,,,no_layer1_issue,none,continue_to_layer2,,0.0,0,0,0
B,NCT00319748,NCT00319748_exc__item13_C1,NCT00319748_exc__item13,C1,exclusion_criteria.children[12].children[0],condition,active autoimmune disease,exists,null,,,partial,Active autoimmune disease,,,,,,no_layer1_issue,none,continue_to_layer2,,0.0,0,0,0
B,NCT00319748,NCT00319748_exc__item13_C2,NCT00319748_exc__item13,C2,exclusion_criteria.children[12].children[1],therapy,immunosuppressive therapy,exists,null,,,partial,requiring immunosuppressive therapy within 30 days,,,,,,no_layer1_issue,none,continue_to_layer2,,0.0,0,0,0
B,NCT00319748,NCT00319748_exc__item14_C1,NCT00319748_exc__item14,C1,exclusion_criteria.children[13].children[0],condition,active coagulation disorder,exists,null,,,computable,Active coagulation disorder not controlled with medication,,,,,,no_layer1_issue,none,continue_to_layer2,,0.0,0,0,0
B,NCT00319748,NCT00319748_exc__item14_C2,NCT00319748_exc__item14,C2,exclusion_criteria.children[13].children[1],observation,coagulation disorder not controlled with medication,exists,null,,,partial,not controlled with medication,,,,,,no_layer1_issue,none,continue_to_layer2,,0.0,0,0,0
B,NCT00319748,NCT00319748_exc__item15_C1,NCT00319748_exc__item15,C1,exclusion_criteria.children[14].children[0],condition,pregnant,exists,null,,,computable,Pregnant,,,,,,no_layer1_issue,none,continue_to_layer2,,0.0,0,0,0
B,NCT00319748,NCT00319748_exc__item15_C2,NCT00319748_exc__item15,C2,exclusion_criteria.children[14].children[1],condition,lactating,exists,null,,,computable,lactating,,,,,,no_layer1_issue,none,continue_to_layer2,,0.0,0,0,0
B,NCT00319748,NCT00319748_exc__item16_C1,NCT00319748_exc__item16,C1,exclusion_criteria.children[15].children[0],condition,concurrent malignancy,exists,null,,,partial,"Concurrent malignancy (if in remission, at least 5 years disease free) except for localized (in-situ) disease, basal carcinomas and cutaneous squamous cell carcinomas that have been adequately treated",,,condition_context_present_without_handling,,layer1c:condition_context_present_without_handling,hard_semantic_or_structural_issue,high,mandatory_verifier_candidate,hard_semantic:condition_context_present_without_handling,1.0,1,0,0
B,NCT00319748,NCT00319748_exc__item16_C2,NCT00319748_exc__item16,C2,exclusion_criteria.children[15].children[1],condition,malignancy in remission with less than 5 years disease free,exists,range,"{""min"": null, ""max"": 5}",year,partial,"if in remission, at least 5 years disease free",existence_operator_with_non_null_value,,condition_context_present_without_handling,,layer1a:existence_operator_with_non_null_value;layer1c:condition_context_present_without_handling,hard_semantic_or_structural_issue,high,mandatory_verifier_candidate,hard_structural:existence_operator_with_non_null_value; hard_semantic:condition_context_present_without_handling,1.0,2,0,0
B,NCT00319748,NCT00319748_exc__item17_C1,NCT00319748_exc__item17,C1,exclusion_criteria.children[16].children[0],condition,brain metastases,exists,null,,,computable,Any history of brain metastases,,,,,,no_layer1_issue,none,continue_to_layer2,,0.0,0,0,0
B,NCT00319748,NCT00319748_exc__item17_C2,NCT00319748_exc__item17,C2,exclusion_criteria.children[16].children[1],condition,active central nervous system (CNS) disease,exists,null,,,partial,any other active central nervous system (CNS) disease,,,,,,no_layer1_issue,none,continue_to_layer2,,0.0,0,0,0
B,NCT02996916,NCT02996916_inc__item1_C1,NCT02996916_inc__item1,C1,inclusion_criteria.children[0],other,written informed consent obtained,exists,null,,,non_computable,Written informed consent obtained,,,,,,no_layer1_issue,none,continue_to_layer2,,0.0,0,0,0
B,NCT02996916,NCT02996916_inc__item2_C1,NCT02996916_inc__item2,C1,inclusion_criteria.children[1].children[0],demographic,sex,=,scalar,"""male""",,computable,Male and female subjects,,,,,,no_layer1_issue,none,continue_to_layer2,,0.0,0,0,0
B,NCT02996916,NCT02996916_inc__item2_C2,NCT02996916_inc__item2,C2,inclusion_criteria.children[1].children[1].children[0],demographic,sex,=,scalar,"""female""",,computable,Male and female subjects,,,,,,no_layer1_issue,none,continue_to_layer2,,0.0,0,0,0
B,NCT02996916,NCT02996916_inc__item2_C3,NCT02996916_inc__item2,C3,inclusion_criteria.children[1].children[1].children[1],demographic,age,>=,scalar,20,year,partial,aged 20 years or older at informed consent,,,,,,no_layer1_issue,none,continue_to_layer2,,0.0,0,0,0
B,NCT02996916,NCT02996916_inc__item3_C1,NCT02996916_inc__item3,C1,inclusion_criteria.children[2].children[0],condition,essential hypertension,exists,null,,,computable,Essential hypertension,,,,,,no_layer1_issue,none,continue_to_layer2,,0.0,0,0,0
B,NCT02996916,NCT02996916_inc__item3_C2,NCT02996916_inc__item3,C2,inclusion_criteria.children[2].children[1],drug,angiotensin II receptor antagonists,not_exists,null,,,partial,had never received angiotensin II receptor antagonists,,,,,,no_layer1_issue,none,continue_to_layer2,,0.0,0,0,0
B,NCT02996916,NCT02996916_inc__item3_C3,NCT02996916_inc__item3,C3,inclusion_criteria.children[2].children[2],drug,calcium channel blockers,not_exists,null,,,partial,and calcium channel blockers,,,,,,no_layer1_issue,none,continue_to_layer2,,0.0,0,0,0
B,NCT02996916,NCT02996916_exc__item1_C1,NCT02996916_exc__item1,C1,exclusion_criteria.children[0].children[0],condition,secondary hypertension,exists,null,,,computable,Secondary hypertension,,,,,,no_layer1_issue,none,continue_to_layer2,,0.0,0,0,0
B,NCT02996916,NCT02996916_exc__item1_C2,NCT02996916_exc__item1,C2,exclusion_criteria.children[0].children[1],condition,malignant hypertension,exists,null,,,computable,malignant hypertension,,,,,,no_layer1_issue,none,continue_to_layer2,,0.0,0,0,0
B,NCT02996916,NCT02996916_exc__item2_C1,NCT02996916_exc__item2,C1,exclusion_criteria.children[1],condition,Diabetes mellitus,exists,null,,,computable,Diabetes mellitus,,,,,,no_layer1_issue,none,continue_to_layer2,,0.0,0,0,0
B,NCT02996916,NCT02996916_exc__item3_C1,NCT02996916_exc__item3,C1,exclusion_criteria.children[2].children[0],condition,stroke,exists,null,,,computable,History or evidence of a stroke,,,,,,no_layer1_issue,none,continue_to_layer2,,0.0,0,0,0
B,NCT02996916,NCT02996916_exc__item3_C2,NCT02996916_exc__item3,C2,exclusion_criteria.children[2].children[1],condition,stroke,exists,null,,,partial,History or evidence of a stroke,,,,,,no_layer1_issue,none,continue_to_layer2,,0.0,0,0,0
B,NCT02996916,NCT02996916_exc__item4_C1,NCT02996916_exc__item4,C1,exclusion_criteria.children[3].children[0],condition,hepatic abnormality,exists,null,,,partial,Hepatic or hematologic abnormality,,,,,,no_layer1_issue,none,continue_to_layer2,,0.0,0,0,0
B,NCT02996916,NCT02996916_exc__item4_C2,NCT02996916_exc__item4,C2,exclusion_criteria.children[3].children[1],condition,hematologic abnormality,exists,null,,,partial,Hepatic or hematologic abnormality,,,,,,no_layer1_issue,none,continue_to_layer2,,0.0,0,0,0
B,NCT02996916,NCT02996916_exc__item5_C1,NCT02996916_exc__item5,C1,exclusion_criteria.children[4].children[0],condition,Mild Cognitive Impairment,exists,null,,,computable,Mild Cognitive Impairment,,,,,,no_layer1_issue,none,continue_to_layer2,,0.0,0,0,0
B,NCT02996916,NCT02996916_exc__item5_C2,NCT02996916_exc__item5,C2,exclusion_criteria.children[4].children[1],condition,Dementia,exists,null,,,computable,Dementia,,,,,,no_layer1_issue,none,continue_to_layer2,,0.0,0,0,0
B,NCT02996916,NCT02996916_exc__item6_C1,NCT02996916_exc__item6,C1,exclusion_criteria.children[5],lab,Serum potassium level,=,scalar,5.5,mEq/L,computable,Serum potassium level = 5.5 mEq/L,,,,,,no_layer1_issue,none,continue_to_layer2,,0.0,0,0,0
B,NCT02996916,NCT02996916_exc__item7_C1,NCT02996916_exc__item7,C1,exclusion_criteria.children[6],lab,Serum creatinine level,=,scalar,3.0,mg/dL,computable,Serum creatinine level = 3.0 mg/dL,,,,,,no_layer1_issue,none,continue_to_layer2,,0.0,0,0,0
B,NCT02996916,NCT02996916_exc__item8_C1,NCT02996916_exc__item8,C1,exclusion_criteria.children[7].children[0],condition,acute disease,exists,null,,,partial,Acute or chronic disease,,,,,,no_layer1_issue,none,continue_to_layer2,,0.0,0,0,0
B,NCT02996916,NCT02996916_exc__item8_C2,NCT02996916_exc__item8,C2,exclusion_criteria.children[7].children[1],condition,chronic disease,exists,null,,,partial,Acute or chronic disease,,,,,,no_layer1_issue,none,continue_to_layer2,,0.0,0,0,0
B,NCT02996916,NCT02996916_exc__item9_C1,NCT02996916_exc__item9,C1,exclusion_criteria.children[8],observation,allergy to any drugs,exists,null,,,partial,Allergy to any drugs,,,,,,no_layer1_issue,none,continue_to_layer2,,0.0,0,0,0
B,NCT02996916,NCT02996916_exc__item10_C1,NCT02996916_exc__item10,C1,exclusion_criteria.children[9],condition,pregnancy,exists,null,,,computable,Pregnancy,,,,,,no_layer1_issue,none,continue_to_layer2,,0.0,0,0,0
B,NCT02604459,NCT02604459_inc__item1_C1,NCT02604459_inc__item1,C1,inclusion_criteria.children[0].children[0],other,Voluntarily signed IRB-approved informed consent (subject),exists,null,,,non_computable,Subject or legal representative has voluntarily signed the informed consent approved by the Institutional Review Board,,,,,,no_layer1_issue,none,continue_to_layer2,,0.0,0,0,0
B,NCT02604459,NCT02604459_inc__item1_C2,NCT02604459_inc__item1,C2,inclusion_criteria.children[0].children[1],other,Voluntarily signed IRB-approved informed consent (legal representative),exists,null,,,non_computable,Subject or legal representative has voluntarily signed the informed consent approved by the Institutional Review Board,,,,,,no_layer1_issue,none,continue_to_layer2,,0.0,0,0,0
B,NCT02604459,NCT02604459_inc__item2_C1,NCT02604459_inc__item2,C1,inclusion_criteria.children[1].children[0],procedure,hip fracture surgery scheduled,exists,null,,,partial,Hip fracture surgery scheduled,,,,,,no_layer1_issue,none,continue_to_layer2,,0.0,0,0,0
B,NCT02604459,NCT02604459_inc__item2_C2,NCT02604459_inc__item2,C2,inclusion_criteria.children[1].children[1],procedure,general anesthesia,exists,null,,,computable,under general anesthesia,,,,,,no_layer1_issue,none,continue_to_layer2,,0.0,0,0,0
B,NCT02604459,NCT02604459_inc__item3_C1,NCT02604459_inc__item3,C1,inclusion_criteria.children[2],demographic,Age,>=,scalar,65,year,computable,Subject is 65 years or older on the day of surgery,,,,,,no_layer1_issue,none,continue_to_layer2,,0.0,0,0,0
B,NCT02604459,NCT02604459_exc__item1_C1,NCT02604459_exc__item1,C1,exclusion_criteria.children[0].children[0],observation,inability to follow directions,exists,null,,,non_computable,Inability to follow directions or comprehend the English language,,,,,,no_layer1_issue,none,continue_to_layer2,,0.0,0,0,0
B,NCT02604459,NCT02604459_exc__item1_C2,NCT02604459_exc__item1,C2,exclusion_criteria.children[0].children[1],observation,inability to comprehend the English language,exists,null,,,non_computable,Inability to follow directions or comprehend the English language,,,,,,no_layer1_issue,none,continue_to_layer2,,0.0,0,0,0
B,NCT02604459,NCT02604459_exc__item2_C1,NCT02604459_exc__item2,C1,exclusion_criteria.children[1].children[0],condition,severe uncorrected visual handicaps,exists,null,,,partial,Severe uncorrected visual or auditory handicaps,,,,,,no_layer1_issue,none,continue_to_layer2,,0.0,0,0,0
B,NCT02604459,NCT02604459_exc__item2_C2,NCT02604459_exc__item2,C2,exclusion_criteria.children[1].children[1],condition,severe uncorrected auditory handicaps,exists,null,,,partial,Severe uncorrected visual or auditory handicaps,,,,,,no_layer1_issue,none,continue_to_layer2,,0.0,0,0,0
B,NCT02604459,NCT02604459_exc__item3_C1,NCT02604459_exc__item3,C1,exclusion_criteria.children[2].children[0],condition,delirium,exists,null,,,partial,Delirium at screening or baseline,,,,,,no_layer1_issue,none,continue_to_layer2,,0.0,0,0,0
B,NCT02604459,NCT02604459_exc__item3_C2,NCT02604459_exc__item3,C2,exclusion_criteria.children[2].children[1],condition,delirium,exists,null,,,partial,Delirium at screening or baseline,,,temporal_anchor_mismatch_from_source,,layer1c:temporal_anchor_mismatch_from_source,hard_semantic_or_structural_issue,high,mandatory_verifier_candidate,hard_semantic:temporal_anchor_mismatch_from_source,1.0,1,0,0
B,NCT02604459,NCT02604459_exc__item4_C1,NCT02604459_exc__item4,C1,exclusion_criteria.children[3],procedure,emergency surgery,exists,null,,,partial,Emergency surgery,,,,,,no_layer1_issue,none,continue_to_layer2,,0.0,0,0,0
B,NCT03247413,NCT03247413_inc__item1_C1,NCT03247413_inc__item1,C1,inclusion_criteria.children[0].children[0],condition,cervical facet pain,exists,null,,,computable,"a diagnosis of either cervical, thoracic, or lumbar facet or sacroiliac joint pain",,,,,,no_layer1_issue,none,continue_to_layer2,,0.0,0,0,0
B,NCT03247413,NCT03247413_inc__item1_C2,NCT03247413_inc__item1,C2,inclusion_criteria.children[0].children[1],condition,thoracic facet pain,exists,null,,,computable,"a diagnosis of either cervical, thoracic, or lumbar facet or sacroiliac joint pain",,,,,,no_layer1_issue,none,continue_to_layer2,,0.0,0,0,0
B,NCT03247413,NCT03247413_inc__item1_C3,NCT03247413_inc__item1,C3,inclusion_criteria.children[0].children[2],condition,lumbar facet pain,exists,null,,,computable,"a diagnosis of either cervical, thoracic, or lumbar facet or sacroiliac joint pain",,,,,,no_layer1_issue,none,continue_to_layer2,,0.0,0,0,0
B,NCT03247413,NCT03247413_inc__item1_C4,NCT03247413_inc__item1,C4,inclusion_criteria.children[0].children[3].children[0],condition,sacroiliac joint pain,exists,null,,,computable,"a diagnosis of either cervical, thoracic, or lumbar facet or sacroiliac joint pain",,,,,,no_layer1_issue,none,continue_to_layer2,,0.0,0,0,0
B,NCT03247413,NCT03247413_inc__item1_C5,NCT03247413_inc__item1,C5,inclusion_criteria.children[0].children[3].children[1],procedure,response to medial branch blocks,exists,null,,,partial,who have responded to medial branch blocks,,,,,,no_layer1_issue,none,continue_to_layer2,,0.0,0,0,0
B,NCT03247413,NCT03247413_inc__item1_C6,NCT03247413_inc__item1,C6,inclusion_criteria.children[0].children[3].children[2],procedure,scheduled for bilateral radiofrequency ablations,exists,null,,,partial,are already scheduled for bilateral radiofrequency ablations,,,,,,no_layer1_issue,none,continue_to_layer2,,0.0,0,0,0
B,NCT03247413,NCT03247413_inc__item2_C1,NCT03247413_inc__item2,C1,inclusion_criteria.children[1],demographic,age,>,scalar,18,year,computable,age greater than 18 years old,,,,,,no_layer1_issue,none,continue_to_layer2,,0.0,0,0,0
B,NCT03247413,NCT03247413_inc__item3_C1,NCT03247413_inc__item3,C1,inclusion_criteria.children[2],demographic,English speaking,exists,null,,,partial,English speaking,,,,,,no_layer1_issue,none,continue_to_layer2,,0.0,0,0,0
B,NCT03247413,NCT03247413_exc__item1_C1,NCT03247413_exc__item1,C1,exclusion_criteria.children[0].children[0],procedure,previously scheduled for radiofrequency ablation of the cervical facets,not_exists,null,,,partial,"patient not previously scheduled for radiofrequency ablation of the cervical, thoracic, or lumbar facets, or sacroiliac joints",,,,,,no_layer1_issue,none,continue_to_layer2,,0.0,0,0,0
B,NCT03247413,NCT03247413_exc__item1_C2,NCT03247413_exc__item1,C2,exclusion_criteria.children[0].children[1],procedure,previously scheduled for radiofrequency ablation of the thoracic facets,not_exists,null,,,partial,"patient not previously scheduled for radiofrequency ablation of the cervical, thoracic, or lumbar facets, or sacroiliac joints",,,,,,no_layer1_issue,none,continue_to_layer2,,0.0,0,0,0
B,NCT03247413,NCT03247413_exc__item1_C3,NCT03247413_exc__item1,C3,exclusion_criteria.children[0].children[2],procedure,previously scheduled for radiofrequency ablation of the lumbar facets,not_exists,null,,,partial,"patient not previously scheduled for radiofrequency ablation of the cervical, thoracic, or lumbar facets, or sacroiliac joints",,,,,,no_layer1_issue,none,continue_to_layer2,,0.0,0,0,0
B,NCT03247413,NCT03247413_exc__item1_C4,NCT03247413_exc__item1,C4,exclusion_criteria.children[0].children[3],procedure,previously scheduled for radiofrequency ablation of the sacroiliac joints,not_exists,null,,,partial,"patient not previously scheduled for radiofrequency ablation of the cervical, thoracic, or lumbar facets, or sacroiliac joints",,,,,,no_layer1_issue,none,continue_to_layer2,,0.0,0,0,0
B,NCT03247413,NCT03247413_exc__item2_C1,NCT03247413_exc__item2,C1,exclusion_criteria.children[1],drug,anticoagulation,exists,null,,,partial,on anticoagulation,,,,,,no_layer1_issue,none,continue_to_layer2,,0.0,0,0,0
B,NCT03247413,NCT03247413_exc__item3_C1,NCT03247413_exc__item3,C1,exclusion_criteria.children[2],procedure,pacemaker,exists,null,,,computable,have a pacemaker,,,,,,no_layer1_issue,none,continue_to_layer2,,0.0,0,0,0
B,NCT03247413,NCT03247413_exc__item4_C1,NCT03247413_exc__item4,C1,exclusion_criteria.children[3],demographic,age,<,scalar,18,year,computable,age less than 18 years old,,,,,,no_layer1_issue,none,continue_to_layer2,,0.0,0,0,0
B,NCT03247413,NCT03247413_exc__item5_C1,NCT03247413_exc__item5,C1,exclusion_criteria.children[4],demographic,English speaking,not_exists,null,,,partial,non-English speaking,,,,positive_clause_with_not_exists_operator,layer1d:positive_clause_with_not_exists_operator,hard_semantic_or_structural_issue,high,mandatory_verifier_candidate,hard_semantic:positive_clause_with_not_exists_operator,1.0,1,0,0
B,NCT02609048,NCT02609048_inc__item1_C1,NCT02609048_inc__item1,C1,inclusion_criteria.children[0].children[0],other,written informed consent (signed and dated),exists,null,,,non_computable,Must have given written informed consent (signed and dated),,,,,,no_layer1_issue,none,continue_to_layer2,,0.0,0,0,0
B,NCT02609048,NCT02609048_inc__item1_C2,NCT02609048_inc__item1,C2,inclusion_criteria.children[0].children[1],other,authorizations required by local law,exists,null,,,non_computable,and any authorizations required by local law,,,,,,no_layer1_issue,none,continue_to_layer2,,0.0,0,0,0
B,NCT02609048,NCT02609048_inc__item2_C1,NCT02609048_inc__item2,C1,inclusion_criteria.children[1],demographic,Age,between,range,"{""min"": 18, ""max"": 75}",year,computable,18 to 75 years old (inclusive),,,,,,no_layer1_issue,none,continue_to_layer2,,0.0,0,0,0
B,NCT02609048,NCT02609048_inc__item3_C1,NCT02609048_inc__item3,C1,inclusion_criteria.children[2].children[0],demographic,sex,=,scalar,"""male""",,computable,Male or female,,,,,,no_layer1_issue,none,continue_to_layer2,,0.0,0,0,0
B,NCT02609048,NCT02609048_inc__item3_C2,NCT02609048_inc__item3,C2,inclusion_criteria.children[2].children[1],demographic,sex,=,scalar,"""female""",,computable,female,,,,,,no_layer1_issue,none,continue_to_layer2,,0.0,0,0,0
B,NCT02609048,NCT02609048_inc__item3_C3,NCT02609048_inc__item3,C3,inclusion_criteria.children[2].children[2],condition,primary biliary cholangitis (PBC),exists,null,,,computable,with a diagnosis of PBC,,,,,,no_layer1_issue,none,continue_to_layer2,,0.0,0,0,0
B,NCT02609048,NCT02609048_inc__item3_C4,NCT02609048_inc__item3,C4,inclusion_criteria.children[2].children[3],other,meets at least two of the following criteria,exists,scalar,2,,partial,by at least two of the following criteria:,existence_operator_with_non_null_value,,,,layer1a:existence_operator_with_non_null_value,hard_semantic_or_structural_issue,high,mandatory_verifier_candidate,hard_structural:existence_operator_with_non_null_value,1.0,1,0,0
B,NCT02609048,NCT02609048_inc__item4_C1,NCT02609048_inc__item4,C1,inclusion_criteria.children[3].children[0],lab,alkaline phosphatase (AP) above upper limit of normal (ULN),exists,null,,,partial,History of AP above ULN for at least six months,,,,,,no_layer1_issue,none,continue_to_layer2,,0.0,0,0,0
B,NCT02609048,NCT02609048_inc__item4_C2,NCT02609048_inc__item4,C2,inclusion_criteria.children[3].children[1],lab,alkaline phosphatase (AP) above upper limit of normal (ULN),exists,null,,,partial,above ULN for at least six months,,,,,,no_layer1_issue,none,continue_to_layer2,,0.0,0,0,0
B,NCT02609048,NCT02609048_inc__item5_C1,NCT02609048_inc__item5,C1,inclusion_criteria.children[4].children[0],lab,Anti-Mitochondrial Antibodies (AMA) titer (immunofluorescence),>,scalar,"""1/40""",,partial,Positive Anti-Mitochondrial Antibodies (AMA) titers (>1/40 on immunofluorescence,,,,,,no_layer1_issue,none,continue_to_layer2,,0.0,0,0,0
B,NCT02609048,NCT02609048_inc__item5_C2,NCT02609048_inc__item5,C2,inclusion_criteria.children[4].children[1],biomarker,M2 antibody (ELISA) positive,exists,null,,,computable,M2 positive by enzyme linked immunosorbent assay (ELISA),,,,,,no_layer1_issue,none,continue_to_layer2,,0.0,0,0,0
B,NCT02609048,NCT02609048_inc__item5_C3,NCT02609048_inc__item5,C3,inclusion_criteria.children[4].children[2],biomarker,PBC-specific antinuclear antibodies positive,exists,null,,,computable,positive PBC-specific antinuclear antibodies,,,,,,no_layer1_issue,none,continue_to_layer2,,0.0,0,0,0
B,NCT02609048,NCT02609048_inc__item6_C1,NCT02609048_inc__item6,C1,inclusion_criteria.children[5],procedure,liver biopsy result consistent with PBC,exists,null,,,partial,Documented liver biopsy result consistent with PBC,,,,,,no_layer1_issue,none,continue_to_layer2,,0.0,0,0,0
B,NCT02609048,NCT02609048_inc__item7_C1,NCT02609048_inc__item7,C1,inclusion_criteria.children[6].children[0],drug,UDCA stable dose,exists,null,,,partial,On a stable and recommended dose of UDCA for the past twelve months,,,,,,no_layer1_issue,none,continue_to_layer2,,0.0,0,0,0
B,NCT02609048,NCT02609048_inc__item7_C2,NCT02609048_inc__item7,C2,inclusion_criteria.children[6].children[1],drug,UDCA recommended dose,exists,null,,,partial,On a stable and recommended dose of UDCA for the past twelve months,,,critical_qualifier_missing_from_entity,,layer1c:critical_qualifier_missing_from_entity,soft_semantic_warning,low_to_medium,continue_to_layer2_grounding_screen,soft_semantic:critical_qualifier_missing_from_entity,0.4,0,1,0
B,NCT02609048,NCT02609048_inc__item8_C1,NCT02609048_inc__item8,C1,inclusion_criteria.children[7],lab,AP,>=,scalar,1.67,× ULN,partial,AP ≥ 1.67 × ULN,,,,,,no_layer1_issue,none,continue_to_layer2,,0.0,0,0,0
